{
  "policyVersion": 2,
  "applicationControl": {
    "mode": "audit-only",
    "blockedApplications": [
      {
        "ruleId": "block-calculator",
        "signingId": "com.apple.calculator"
      }
    ]
  },
  "webUploadControl": {
    "mode": "audit-only",
    "protectedDirectoryNames": [
      "Desktop",
      "Documents",
      "Downloads"
    ],
    "nativeUploadClients": [
      { "ruleId": "upload-whatsapp-main", "signingId": "net.whatsapp.WhatsApp", "teamId": "57T9237FN3" },
      { "ruleId": "upload-whatsapp-intents", "signingId": "net.whatsapp.WhatsApp.Intents", "teamId": "57T9237FN3" },
      { "ruleId": "upload-whatsapp-service-extension", "signingId": "net.whatsapp.WhatsApp.ServiceExtension", "teamId": "57T9237FN3" }
    ]
  },
  "emailAttachmentControl": {
    "mode": "audit-only",
    "mailClients": [
      { "ruleId": "email-apple-mail", "signingId": "com.apple.mail", "isPlatformBinary": true },
      { "ruleId": "email-microsoft-outlook", "signingId": "com.microsoft.Outlook", "teamId": "UBF8T346G9" }
    ],
    "protectedClassifications": []
  },
  "usbStorageControl": {
    "mode": "disabled",
    "blockExternalStorage": true,
    "encryptionMode": "audit-only",
    "containerSizePercent": 90
  },
  "nearbyTransferControl": {
    "mode": "audit-only",
    "blockAirDrop": true,
    "blockBluetoothFileTransfer": true,
    "protectedDirectoryNames": [
      "Desktop",
      "Documents",
      "Downloads"
    ]
  },
  "clipboardControl": {
    "mode": "disabled",
    "blockedApplications": []
  },
  "printerControl": {
    "mode": "audit-only",
    "blockAllPrinters": true
  },
  "opticalDiskImageControl": {
    "mode": "audit-only",
    "blockDiskImages": true,
    "blockOpticalMedia": true
  },
  "printToPDFControl": {
    "mode": "audit-only",
    "blockSaveAsPDF": true
  },
  "ocrControl": {
    "egressMode": "audit-only",
    "protectedEgressChannels": ["usb", "web-upload", "email", "nearby-transfer"],
    "protectedEgressClassifications": [],
    "mode": "audit-only",
    "screenshotMode": "audit-only",
    "screenshotRemediation": "quarantine",
    "recognitionLanguages": ["en-US"],
    "minimumConfidence": 0.5,
    "maxFileSizeMB": 100,
    "maxPDFPages": 100
  },
  "endpointDiscoveryControl": {
    "mode": "audit-only",
    "scheduleIntervalMinutes": 1440,
    "includeLocalHome": true,
    "includeMountedVolumes": true,
    "includeMountedShares": true,
    "tagClassifiedFiles": false,
    "maxFilesPerScan": 10000
  },
  "networkFlowControl": {
    "mode": "audit-only",
    "defaultAction": "allow",
    "rules": [
      {
        "ruleId": "audit-suspicious-exfil",
        "domain": "transfer.sh",
        "port": 443,
        "protocol": "tcp",
        "action": "block"
      }
    ]
  }
}
