{
  "policyVersion": 1,
  "applicationControl": {
    "mode": "enforce",
    "blockedApplications": [
      {
        "ruleId": "block-calculator",
        "signingId": "com.apple.calculator"
      }
    ]
  },
  "webUploadControl": {
    "mode": "disabled",
    "protectedDirectoryNames": [
      "Desktop",
      "Documents",
      "Downloads",
      "Movies",
      "Music",
      "Pictures",
      "Public"
    ],
    "nativeUploadClients": [
      { "ruleId": "upload-whatsapp-main", "signingId": "net.whatsapp.WhatsApp", "teamId": "57T9237FN3" },
      { "ruleId": "upload-whatsapp-intents", "signingId": "net.whatsapp.WhatsApp.Intents", "teamId": "57T9237FN3" },
      { "ruleId": "upload-whatsapp-service-extension", "signingId": "net.whatsapp.WhatsApp.ServiceExtension", "teamId": "57T9237FN3" }
    ]
  },
  "emailAttachmentControl": {
    "mode": "audit-only",
    "mailClients": [
      { "ruleId": "email-apple-mail", "signingId": "com.apple.mail", "isPlatformBinary": true },
      { "ruleId": "email-microsoft-outlook", "signingId": "com.microsoft.Outlook", "teamId": "UBF8T346G9" }
    ],
    "protectedClassifications": []
  },
  "usbStorageControl": {
    "mode": "enforce",
    "blockExternalStorage": true,
    "encryptionMode": "disabled",
    "containerSizePercent": 90
  },
  "nearbyTransferControl": {
    "mode": "disabled",
    "blockAirDrop": true,
    "blockBluetoothFileTransfer": true,
    "protectedDirectoryNames": [
      "Desktop",
      "Documents",
      "Downloads",
      "Movies",
      "Music",
      "Pictures",
      "Public"
    ]
  },
  "clipboardControl": {
    "mode": "disabled",
    "blockedApplications": []
  },
  "printerControl": {
    "mode": "disabled",
    "blockAllPrinters": true
  },
  "opticalDiskImageControl": {
    "mode": "disabled",
    "blockDiskImages": true,
    "blockOpticalMedia": true
  },
  "printToPDFControl": {
    "mode": "disabled",
    "blockSaveAsPDF": true
  },
  "ocrControl": {
    "mode": "enforce",
    "egressMode": "enforce",
    "protectedEgressChannels": ["usb", "web-upload", "email", "nearby-transfer"],
    "protectedEgressClassifications": [],
    "screenshotMode": "audit-only",
    "screenshotRemediation": "quarantine",
    "recognitionLanguages": ["en-US"],
    "minimumConfidence": 0.5,
    "maxFileSizeMB": 100,
    "maxPDFPages": 100,
    "rules": [
      {
        "ruleId": "ocr-payment-card",
        "name": "Payment card number",
        "classification": "Payment Card Data",
        "type": "credit-card"
      },
      {
        "ruleId": "ocr-indian-pan",
        "name": "Indian PAN",
        "classification": "Indian Tax Identifier",
        "type": "indian-pan"
      },
      {
        "ruleId": "ocr-aadhaar",
        "name": "Aadhaar number",
        "classification": "Indian Identity Data",
        "type": "aadhaar"
      },
      {
        "ruleId": "ocr-confidential-keywords",
        "name": "Confidential document markers",
        "classification": "Confidential Document",
        "type": "keyword",
        "keywords": ["confidential", "restricted", "internal only"]
      }
    ]
  },
  "endpointDiscoveryControl": {
    "mode": "audit-only",
    "scheduleIntervalMinutes": 1440,
    "includeLocalHome": true,
    "includeMountedVolumes": true,
    "includeMountedShares": true,
    "tagClassifiedFiles": true,
    "maxFilesPerScan": 10000
  },
  "networkFlowControl": {
    "mode": "disabled",
    "defaultAction": "allow",
    "rules": [
      {
        "ruleId": "block-raw-pastebin",
        "domain": "pastebin.com",
        "protocol": "tcp",
        "action": "block"
      }
    ]
  }
}
